,input,output,instruction
106,Singapore,"Do boys like you more when you're ignoring them?
If I don't make dick jokes am I boring then?
I said ""Walao"", am I Singaporean?",Generate a verse that creatively incorporates the given city name in a whimsical and slighly naughty way.
107,Singapore,"Fell in love with you, I think I'm done for
Came five times but I think I need one more
You're the greatest night I've had Singapore",Generate a verse that creatively incorporates the given city name in a whimsical and slighly naughty way.
108,Coachella,"All about the balls, I'm Cinderella
Only use my mouth that's acapella
I'm so glad you came for me Coachella",Generate a verse that creatively incorporates the given city name in a whimsical and slighly naughty way.
109,Coachella,"Made his knees so weak he had to spread mine
He's drinkin' my bath water like it's red wine
Coachella, see you back here when I headline",Generate a verse that creatively incorporates the given city name in a whimsical and slighly naughty way.
110,Saturday Night Live,"He is 30 rock hard 'cause I said ""Hi""
My sense of humor is but I am not dry
SNL I just came for the first time",Generate a verse that creatively incorporates the given city name in a whimsical and slighly naughty way.
111,BBC1 Radio Live,"BBC said I should keep it PG
BBC I wish I had it in me
There's a double meaning if you dig deep",Generate a verse that creatively incorporates the given city name in a whimsical and slighly naughty way.
112,Governors Ball,"Do I text him back? It's such a tough call
That won't fit inside me, bro, I'm dumb small
People who hate pride can suck my gov balls",Generate a verse that creatively incorporates the given city name in a whimsical and slighly naughty way.
113,Capital's Summertime Ball,"Boy, that thing so big I call it ""Wembley""
I stay on that head and do it rent free
Capital FM you bloody wrecked me",Generate a verse that creatively incorporates the given city name in a whimsical and slighly naughty way.
114,Outside Lands,"Soon cometh my album so exciting
My heart doth pound beneath my breasts, so mighty
Outside Lands, it’s like thou art inside me",Generate a verse that creatively incorporates the given city name in a whimsical and slighly naughty way.
